{
  "$schema": "https://json-schema.org/draft/2020-12/schema",
  "$id": "https://delano.dev/schemas/adapter-manifest.schema.json",
  "title": "Delano Adapter Manifest",
  "type": "object",
  "additionalProperties": false,
  "required": [
    "id",
    "name",
    "type",
    "owner",
    "status",
    "summary",
    "commands",
    "generated_files",
    "validation",
    "install",
    "limits"
  ],
  "properties": {
    "id": {
      "type": "string",
      "pattern": "^[a-z0-9]+(-[a-z0-9]+)*$"
    },
    "name": {
      "type": "string",
      "minLength": 1
    },
    "type": {
      "type": "string",
      "enum": ["agent", "authoring-tool", "sync-tool", "workflow"]
    },
    "owner": {
      "type": "string",
      "minLength": 1
    },
    "status": {
      "type": "string",
      "enum": ["proposed", "experimental", "stable", "deprecated"]
    },
    "summary": {
      "type": "string",
      "minLength": 1
    },
    "commands": {
      "type": "array",
      "minItems": 1,
      "items": {
        "type": "object",
        "additionalProperties": false,
        "required": ["name", "description", "input", "output", "writes", "validation"],
        "properties": {
          "name": { "type": "string", "minLength": 1 },
          "description": { "type": "string", "minLength": 1 },
          "input": { "type": "array", "items": { "type": "string" } },
          "output": { "type": "array", "items": { "type": "string" } },
          "writes": { "type": "array", "items": { "type": "string" } },
          "validation": { "type": "array", "items": { "type": "string" } }
        }
      }
    },
    "generated_files": {
      "type": "array",
      "items": {
        "type": "object",
        "additionalProperties": false,
        "required": ["path", "owner", "mode", "conflict_behavior", "fold_forward"],
        "properties": {
          "path": { "type": "string", "minLength": 1 },
          "owner": { "type": "string", "minLength": 1 },
          "mode": {
            "type": "string",
            "enum": ["create-only", "update-owned", "proposal-only", "never-overwrite"]
          },
          "conflict_behavior": {
            "type": "string",
            "enum": ["abort", "diff-required", "operator-approval-required"]
          },
          "fold_forward": { "type": "string", "minLength": 1 }
        }
      }
    },
    "validation": {
      "type": "array",
      "minItems": 1,
      "items": { "type": "string" }
    },
    "install": {
      "type": "object",
      "additionalProperties": false,
      "required": ["categories", "conflict_policy"],
      "properties": {
        "categories": {
          "type": "array",
          "items": { "type": "string" }
        },
        "conflict_policy": {
          "type": "string",
          "minLength": 1
        }
      }
    },
    "limits": {
      "type": "array",
      "minItems": 1,
      "items": { "type": "string" }
    }
  }
}
